{
  "$schema": "https://json-schema.org/draft/2020-12/schema",
  "$id": "kc-plan-approval/v1",
  "title": "kc-plan-approval v1",
  "description": "The Captain's dispatch authorization for one receipt. Separate from the receipt so the receipt is content and the approval is authority. ship-flow refuses a receipt without a matching approval whose receipt_sha256 equals the receipt's.",
  "type": "object",
  "additionalProperties": false,
  "required": ["schema", "receipt_sha256", "approver", "approved_at", "decision", "max_workspaces", "concurrency", "repair_rounds", "quote", "quote_source", "defaults"],
  "properties": {
    "schema": {"const": "kc-plan-approval/v1"},
    "receipt_sha256": {"type": "string", "pattern": "^[0-9a-f]{64}$"},
    "approver": {"type": "string", "pattern": "^person:[a-z0-9-]+$"},
    "approved_at": {"type": "string", "format": "date-time"},
    "decision": {"enum": ["go", "discover", "stop"], "description": "go authorizes dispatch; discover and stop carry no dispatch authority and ship-flow refuses them"},
    "max_workspaces": {"type": "integer", "minimum": 0},
    "concurrency": {"type": "integer", "minimum": 1},
    "repair_rounds": {"type": "integer", "minimum": 0, "maximum": 2},
    "quote": {"type": "string", "minLength": 1, "description": "the Captain's authorizing words, verbatim"},
    "quote_source": {"type": "string", "minLength": 1},
    "defaults": {
      "type": "object",
      "additionalProperties": false,
      "required": ["findings_outside_brief", "minimal_necessity_fail", "moved_base", "worker_blocker", "empty_reviewer", "pr_creation"],
      "properties": {
        "findings_outside_brief": {
          "type": "array",
          "items": {"enum": ["security", "data-loss", "compatibility"]},
          "description": "which review-finding classes block the candidate; security, data-loss, and compatibility block; everything else is listed in UAT"
        },
        "minimal_necessity_fail": {
          "enum": ["accepted_no_pr"],
          "description": "when a candidate's falsifier cannot fail: record accepted_no_pr and carry disposition to UAT; do not open PR"
        },
        "moved_base": {
          "enum": ["rebase_and_accept"],
          "description": "when base advances under an accepted candidate: rebase and re-accept; do not ask"
        },
        "worker_blocker": {
          "enum": ["skip_issue_continue_batch"],
          "description": "when worker stops on BLOCKER: skip that Issue, continue rest, list in UAT"
        },
        "empty_reviewer": {
          "enum": ["fallback_to_fo_diff_read"],
          "description": "when cross-model reviewer returns nothing: treat as reviewer-absent, FO reads diff, record absence"
        },
        "pr_creation": {
          "enum": ["batch_approve_draft"],
          "description": "whether FO opens Draft PRs without per-PR approval: one approval authorizes whole batch's Draft PRs"
        }
      }
    }
  }
}
